{
  "registry_name": "Runtime Collector Eligibility Registry v0",
  "registry_version": "runtime-collector-eligibility-v0",
  "generated_for": "hawkinsoperations-platform",
  "proof_ceiling": "PRIVATE_RUNTIME_CANDIDATE_ONLY",
  "public_safe_status": "NOT_PUBLIC_SAFE",
  "org_wide_auto_collection": false,
  "current_collector_scope": "HO-DET-001_ONLY",
  "append_requires_human_approval": true,
  "collector_behavior_changed_by_this_registry": false,
  "detections": [
    {
      "detection_id": "HO-DET-001",
      "source_status": "SOURCE_EXISTS_LISTED",
      "validation_status": "CONTROLLED_TEST_VALIDATED",
      "proof_status": "PROOF_RECORD_EXISTS",
      "collector_eligibility": "ELIGIBLE_CURRENT_TARGET",
      "collector_target_proven": true,
      "collector_row_observed": true,
      "collector_row_count": 2,
      "current_safe_status": "RUNTIME_CANDIDATE_ONLY",
      "next_gate": "DECIDE_SINGLE_TARGET_OR_REGISTRY_BASED_ELIGIBILITY",
      "public_claim_allowed": false,
      "runtime_claim_allowed": false,
      "case_closure_allowed": false,
      "disposition_allowed": false,
      "notes": "Only current collector target. Collector rows are governed runtime candidates and remain NOT_PUBLIC_SAFE."
    },
    {
      "detection_id": "HO-DET-011",
      "source_status": "SOURCE_EXISTS_LISTED",
      "validation_status": "CONTROLLED_TEST_VALIDATED",
      "proof_status": "PROOF_RECORD_EXISTS_NO_COLLECTOR_ROW_OBSERVED",
      "collector_eligibility": "ELIGIBLE_PENDING_REGISTRY",
      "collector_target_proven": false,
      "collector_row_observed": false,
      "collector_row_count": 0,
      "current_safe_status": "NOT_PUBLIC_SAFE",
      "next_gate": "ADD_EXPLICIT_COLLECTOR_ELIGIBILITY_AND_TARGET_MAPPING",
      "public_claim_allowed": false,
      "runtime_claim_allowed": false,
      "case_closure_allowed": false,
      "disposition_allowed": false,
      "notes": "Existing ledger/history/proof/validation does not equal runtime collector collection unless collector rows are observed."
    },
    {
      "detection_id": "HO-DET-012",
      "source_status": "SOURCE_EXISTS_LISTED",
      "validation_status": "CONTROLLED_TEST_VALIDATED",
      "proof_status": "PROOF_RECORD_EXISTS_NO_COLLECTOR_ROW_OBSERVED",
      "collector_eligibility": "ELIGIBLE_PENDING_REGISTRY",
      "collector_target_proven": false,
      "collector_row_observed": false,
      "collector_row_count": 0,
      "current_safe_status": "NOT_PUBLIC_SAFE",
      "next_gate": "ADD_EXPLICIT_COLLECTOR_ELIGIBILITY_AND_TARGET_MAPPING",
      "public_claim_allowed": false,
      "runtime_claim_allowed": false,
      "case_closure_allowed": false,
      "disposition_allowed": false,
      "notes": "Existing ledger/history/proof/validation does not equal runtime collector collection unless collector rows are observed."
    },
    {
      "detection_id": "HO-DET-013",
      "source_status": "SOURCE_EXISTS_LISTED",
      "validation_status": "VALIDATION_PLANNED",
      "proof_status": "NO_COLLECTOR_LINKED_PROOF_OBSERVED",
      "collector_eligibility": "NEEDS_VALIDATION",
      "collector_target_proven": false,
      "collector_row_observed": false,
      "collector_row_count": 0,
      "current_safe_status": "NOT_COLLECTOR_ELIGIBLE_YET",
      "next_gate": "COMPLETE_VALIDATION_BEFORE_COLLECTOR_ELIGIBILITY",
      "public_claim_allowed": false,
      "runtime_claim_allowed": false,
      "case_closure_allowed": false,
      "disposition_allowed": false,
      "notes": "Source/listed status does not establish runtime collector collection."
    },
    {
      "detection_id": "ID-DET-001",
      "source_status": "SOURCE_EXISTS_LISTED",
      "validation_status": "CONTROLLED_TEST_VALIDATED",
      "proof_status": "NO_COLLECTOR_LINKED_PROOF_OBSERVED",
      "collector_eligibility": "NEEDS_COLLECTOR_DESIGN",
      "collector_target_proven": false,
      "collector_row_observed": false,
      "collector_row_count": 0,
      "current_safe_status": "CONTROLLED_VALIDATION_ONLY",
      "next_gate": "CREATE_IDENTITY_COLLECTOR_DESIGN",
      "public_claim_allowed": false,
      "runtime_claim_allowed": false,
      "case_closure_allowed": false,
      "disposition_allowed": false,
      "notes": "Identity collector design is required before runtime collection claim."
    },
    {
      "detection_id": "ID-DET-002",
      "source_status": "SOURCE_EXISTS_LISTED",
      "validation_status": "CONTROLLED_TEST_VALIDATED",
      "proof_status": "NO_COLLECTOR_LINKED_PROOF_OBSERVED",
      "collector_eligibility": "NEEDS_COLLECTOR_DESIGN",
      "collector_target_proven": false,
      "collector_row_observed": false,
      "collector_row_count": 0,
      "current_safe_status": "CONTROLLED_VALIDATION_ONLY",
      "next_gate": "CREATE_IDENTITY_COLLECTOR_DESIGN",
      "public_claim_allowed": false,
      "runtime_claim_allowed": false,
      "case_closure_allowed": false,
      "disposition_allowed": false,
      "notes": "Identity collector design is required before runtime collection claim."
    },
    {
      "detection_id": "ID-DET-003",
      "source_status": "SOURCE_EXISTS_LISTED",
      "validation_status": "CONTROLLED_TEST_VALIDATED",
      "proof_status": "NO_COLLECTOR_LINKED_PROOF_OBSERVED",
      "collector_eligibility": "NEEDS_COLLECTOR_DESIGN",
      "collector_target_proven": false,
      "collector_row_observed": false,
      "collector_row_count": 0,
      "current_safe_status": "CONTROLLED_VALIDATION_ONLY",
      "next_gate": "CREATE_IDENTITY_COLLECTOR_DESIGN",
      "public_claim_allowed": false,
      "runtime_claim_allowed": false,
      "case_closure_allowed": false,
      "disposition_allowed": false,
      "notes": "Identity collector design is required before runtime collection claim."
    },
    {
      "detection_id": "ID-DET-004",
      "source_status": "SOURCE_EXISTS_LISTED",
      "validation_status": "CONTROLLED_TEST_VALIDATED",
      "proof_status": "NO_COLLECTOR_LINKED_PROOF_OBSERVED",
      "collector_eligibility": "NEEDS_COLLECTOR_DESIGN",
      "collector_target_proven": false,
      "collector_row_observed": false,
      "collector_row_count": 0,
      "current_safe_status": "CONTROLLED_VALIDATION_ONLY",
      "next_gate": "CREATE_IDENTITY_COLLECTOR_DESIGN",
      "public_claim_allowed": false,
      "runtime_claim_allowed": false,
      "case_closure_allowed": false,
      "disposition_allowed": false,
      "notes": "Identity collector design is required before runtime collection claim."
    },
    {
      "detection_id": "AWS-DET-001",
      "source_status": "SOURCE_EXISTS_LISTED",
      "validation_status": "CONTROLLED_TEST_VALIDATED",
      "proof_status": "PROOF_RECORD_EXISTS_NO_COLLECTOR_ROW_OBSERVED",
      "collector_eligibility": "NEEDS_COLLECTOR_DESIGN",
      "collector_target_proven": false,
      "collector_row_observed": false,
      "collector_row_count": 0,
      "current_safe_status": "CONTROLLED_VALIDATION_ONLY",
      "next_gate": "CREATE_CLOUD_COLLECTOR_DESIGN",
      "public_claim_allowed": false,
      "runtime_claim_allowed": false,
      "case_closure_allowed": false,
      "disposition_allowed": false,
      "notes": "Cloud collector design is required before runtime collection claim; AWS-live remains blocked unless separately proven."
    },
    {
      "detection_id": "HO-PIPE-001",
      "source_status": "SOURCE_OR_CONTRACT_LISTED",
      "validation_status": "VALIDATION_ARTIFACT_PRESENT",
      "proof_status": "NO_COLLECTOR_LINKED_PROOF_OBSERVED",
      "collector_eligibility": "NEEDS_TELEMETRY_CONTRACT",
      "collector_target_proven": false,
      "collector_row_observed": false,
      "collector_row_count": 0,
      "current_safe_status": "TELEMETRY_CONTRACT_ONLY",
      "next_gate": "FINISH_TELEMETRY_CONTRACT_AND_COLLECTOR_DESIGN",
      "public_claim_allowed": false,
      "runtime_claim_allowed": false,
      "case_closure_allowed": false,
      "disposition_allowed": false,
      "notes": "Pipeline/telemetry contract status does not establish runtime collector collection."
    },
    {
      "detection_id": "HO-NDR-002",
      "source_status": "LISTED_TELEMETRY_CONTRACT_NEED",
      "validation_status": "UNKNOWN",
      "proof_status": "NO_COLLECTOR_LINKED_PROOF_OBSERVED",
      "collector_eligibility": "NEEDS_TELEMETRY_CONTRACT",
      "collector_target_proven": false,
      "collector_row_observed": false,
      "collector_row_count": 0,
      "current_safe_status": "LISTED_ONLY",
      "next_gate": "DEFINE_TELEMETRY_CONTRACT_BEFORE_COLLECTOR_ELIGIBILITY",
      "public_claim_allowed": false,
      "runtime_claim_allowed": false,
      "case_closure_allowed": false,
      "disposition_allowed": false,
      "notes": "Listed telemetry need does not establish runtime collector collection."
    }
  ]
}
